word	definition
senta	x₁ (Entity) is a layer or stratum of material x₂ (Entity) within structure x₃ (Entity)
senva	x₁ (Entity) dreams about x₂ (du'u, Proposition or Idea) 
sepli	x₁ (Entity) is apart or separate from x₂ (Entity) separated by x₃ (Entity)
serti	x₁ (Entity) is stairs or stairway or steps for climbing structure x₂ (Entity) with steps x₃ (Entity)
setca	x₁ (Entity) inserts or interposes or puts x₂ (Entity) into interior x₃ (Entity)
sevzi	x₁ (Entity) is a self or ego or identity-image of x₂ (Entity)
sfani	x₁ (Organism) is a fly of species x₂ (Taxon)
sfasa	x₁ (Entity) punishes x₂ (Entity) for infraction x₃ (nu, Event or State) with punishment x₄ (nu, Event or State)
sfofa	x₁ (Entity) is a sofa or couch
sfubu	x₁ (Entity) dives or swoops to x₂ (Location or Entity) from x₃ (Location or Entity)
siclu	x₁ (Entity) whistles sound x₂ (Sound)
sicni	x₁ (Entity) is a coin or token issued by x₂ (Entity) having value x₃ (Number or Entity) of composition including x₄ (Entity)
sidbo	x₁ (si'o, Idea) is an idea or concept or thought about x₂ (Entity or Abstraction) by thinker x₃ (Entity)
sidju	x₁ (Entity) helps or assists or aids x₂ (Entity) to do event or activity x₃ (nu, Event)
sigja	x₁ (Entity) is a cigar or cigarette made from tobacco or smokable substance x₂ (Entity) by x₃ (Entity)
silka	x₁ (Entity) is a quantity of or contains or is made of silk produced by x₂ (Entity)
silna	x₁ (Entity) is a quantity of or contains or is made of salt from source x₂ (Entity) of composition including x₃ (Entity)
simlu	x₁ (Entity) seems or appears to have properties x₂ (ka, Property of x₁) to observer x₃ (Entity) under conditions x₄ (nu, Event)
simsa	T: Entity. x₁ (T) is similar or parallel to x₂ (T) in property or quantity x₃ (ka, Property of x₁)
simxu	x₁ (Set<Entity>) has members who mutually do x₂ (Relation<Pair<members of x₁>>) to each other
since	x₁ (Organism) is a snake or serpent of species x₂ (Taxon)
sinma	x₁ (Entity) esteems or respects or venerates x₂ (Entity)
sinso	x₁ (Number) is the trigonometric sine of angle x₂ (Number)
sinxa	x₁ (Entity or Text) is a sign or symbol or signal representing x₂ (Entity or Abstraction) to observer x₃ (Entity)
sipna	x₁ (Entity) is asleep
sirji	x₁ (Entity) is straight or a direct line segment between x₂ (Entity) and x₃ (Entity)
sirxo	x₁ (Entity) reflects Syrian culture or nationality in aspect x₂ (ka, Property of x₁)
sisku	x₁ (Entity) seeks or searches for property x₂ (ka, Property of member of set x₃) among set x₃ (Set<Entity>)
sisti	x₁ (Entity) ceases or stops or halts activity or process or state x₂ (nu, Event or State)
sitna	x₁ (Entity) cites or quotes or refers to source x₂ (Entity) for information x₃ (du'u, Proposition)
sivni	x₁ (Entity) is private or personal to x₂ (Entity)
skaci	x₁ (Entity) is a skirt or kilt or dress of material x₂ (Entity)
skami	x₁ (Entity) is a computer for purpose x₂ (nu, Event)
skapi	x₁ (Entity) is a pelt or skin or hide or leather from x₂ (Entity)
skari	x₁ (Entity) is or appears to be of color x₂ (Entity) as perceived by x₃ (Entity) under conditions x₄ (nu, Event)
skicu	x₁ (Entity) tells about or describes object or event or state x₂ (Entity or nu, Event or State) to audience x₃ (Entity or Group<Entity>) with description x₄ (ka, Property of x₂)
skiji	x₁ (Entity) is a ski or skid or skate for surface x₂ (Entity) supporting x₃ (Entity)
skina	x₁ (Entity) is a cinema or movie or film about x₂ (Entity) by filmmaker x₃ (Entity) for audience x₄ (Entity or Group<Entity>)
skori	x₁ (Entity) is cord or cable or rope of material x₂ (Entity)
skoto	x₁ (Entity) reflects Gaelic or Scottish culture or nationality or language in aspect x₂ (ka, Property of x₁)
skuro	x₁ (Entity) is a groove or trench or furrow in object or surface x₂ (Entity)
slabu	x₁ (Entity) is old or familiar or well-known to observer x₂ (Entity) in feature x₃ (ka, Property of x₁) by standard x₄ (si'o, Standard)
slaka	x₁ (Text) is a syllable in language x₂ (Language)
slami	x₁ (Entity) is a quantity of or contains or is made of acid of composition x₂ (Entity)
slanu	x₁ (Entity) is a cylinder shape of material x₂ (Entity)
slari	x₁ (Entity) is sour or tart to observer x₂ (Entity)
slasi	x₁ (Entity) is a quantity of or contains or is made of plastic of type x₂ (Entity)
sligu	x₁ (Entity) is solid of composition including x₂ (Entity) under conditions x₃ (nu, Event)
slilu	x₁ (Entity) oscillates at frequency x₂ (Number or Entity) through states x₃ (Sequence<Entity> or Set<Entity>)
sliri	x₁ (Entity) is a quantity of or contains or is made of sulfur x₂ (Entity)
slovo	x₁ (Entity) reflects Slavic language or culture or ethos in aspect x₂ (ka, Property of x₁)
sluji	x₁ (Entity) is a muscle body-part controlling x₂ (Entity) of body x₃ (Entity)
sluni	x₁ (Entity) is a quantity of or contains onions of type x₂ (Taxon)
smacu	x₁ (Organism) is a mouse of species x₂ (Taxon)
smadi	x₁ (Entity) guesses or conjectures that x₂ (du'u, Proposition) is true about subject x₃ (Entity)
smaji	x₁ (Entity) is quiet or silent at observation point x₂ (Entity) by standard x₃ (si'o, Standard)
smani	x₁ (Organism) is a monkey or ape of species x₂ (Taxon)
smoka	x₁ (Entity) is a sock or stocking garment of material x₂ (Entity)
smuci	x₁ (Entity) is a spoon or scoop tool for use x₂ (nu, Event) made of material x₃ (Entity)
smuni	x₁ (Entity) is a meaning or interpretation of x₂ (Entity or Text) recognized by x₃ (Entity)
snada	x₁ (Entity) succeeds in or achieves or completes x₂ (ka, Property of x₁) as result of effort x₃ (ka, Property of x₁)
snanu	x₁ (Entity) is to the south of x₂ (Entity) according to frame x₃ (Entity)
snidu	x₁ (TimeInterval) is x₂ (Number) seconds in duration by standard x₃ (si'o, Standard)
snime	x₁ (Entity) is a quantity of or contains snow
snipa	x₁ (Entity) adheres or sticks to x₂ (Entity)
snuji	x₁ (Entity) is a sandwich or layering of x₂ (Entity) sandwiched between x₃ (Group<Entity>)
snura	x₁ (Entity) is secure or safe from threat x₂ (nu, Event)
snuti	x₁ (nu, Event or State) is an accident or unintentional event on the part of x₂ (Entity)
sobde	x₁ (Entity) is a quantity of soya grain of species x₂ (Taxon)
sodna	x₁ (Entity) is a quantity of or contains or is made of alkali metal of type x₂ (Entity)
sodva	x₁ (Entity) is a quantity of or contains or is made of carbonated beverage of flavor or brand x₂ (Entity)
softo	x₁ (Entity) reflects Soviet or CIS culture or nationality in aspect x₂ (ka, Property of x₁)
solji	x₁ (Entity) is a quantity of or contains or is made of gold of composition including x₂ (Entity)
solri	x₁ (Entity) is the sun of home planet x₂ (Entity) of race x₃ (Entity)
sombo	x₁ (Entity) sows or plants crop x₂ (Entity) at location x₃ (Location)
sonci	x₁ (Entity) is a soldier or warrior of army x₂ (Group<Entity>)
sorcu	x₁ (Entity) is a store or deposit or supply of materials or energy x₂ (Entity or Group<Entity>) in containment x₃ (Entity)
sorgu	x₁ (Entity) is a quantity of sorghum of species x₂ (Taxon)
sovda	x₁ (Entity) is an egg or gamete of organism x₂ (Organism)
spaji	x₁ (nu, Event) surprises or startles x₂ (Entity)
spali	x₁ (Entity) polishes object or surface x₂ (Entity) with polish x₃ (Entity) using tool x₄ (Entity)
spano	x₁ (Entity) reflects Spanish-speaking culture or nationality or language in aspect x₂ (ka, Property of x₁)
spati	x₁ (Organism) is a plant of species x₂ (Taxon)
speni	x₁ (Entity) is married to x₂ (Entity) under system x₃ (Entity)
spisa	x₁ (Entity) is a piece or portion or lump or chunk or particle of substance x₂ (Entity)
spita	x₁ (Location) is a hospital treating patient x₂ (Entity) for condition x₃ (nu, Event or ka, Property of x₂)
spofu	x₁ (Entity) is broken or inoperable for function x₂ (ka, Property of x₁ or nu, Event)
spoja	x₁ (nu, Event) bursts or explodes into pieces x₂ (Entity)
spuda	x₁ (Entity) replies or responds to stimulus x₂ (Entity or nu, Event) with response x₃ (Entity or nu, Event)
sputu	x₁ (Entity) spits or expectorates x₂ (Entity) from x₃ (Entity) to x₄ (Entity)
sraji	x₁ (Entity) is vertical or upright or erect in reference frame or gravity x₂ (Entity)
sraku	x₁ (Entity) scratches or carves or erodes or cuts into x₂ (Entity)
sralo	x₁ (Entity) reflects Australian culture or nationality or geography or dialect in aspect x₂ (ka, Property of x₁)
srana	x₁ (Entity) pertains to or is relevant to or concerns x₂ (Entity)
srasu	x₁ (Entity) is a blade or expanse of grass of species x₂ (Taxon)
srera	x₁ (Entity) errs in doing event x₂ (nu, Event) under conditions x₃ (nu, Event) by standard x₄ (Entity)
srito	x₁ (Entity) reflects Sanskrit language or culture or nationality in aspect x₂ (ka, Property of x₁)
sruma	x₁ (Entity) assumes or supposes that x₂ (du'u, Proposition) is true about subject x₃ (Entity)
sruri	x₁ (Entity) encircles or encloses or surrounds x₂ (Entity) in direction or dimension or plane x₃ (Entity)
stace	x₁ (Entity) is honest or truthfully revealing to x₂ (Entity) about matter x₃ (du'u, Proposition)
stagi	x₁ (Entity) is an edible portion x₂ (Entity) of plant x₃ (Entity)
staku	x₁ (Entity) is a quantity of or contains or is made of ceramic made by x₂ (Entity) of composition x₃ (Entity) in form x₄ (Entity)
stali	x₁ (Entity) remains or stays or abides with x₂ (Entity)
stani	x₁ (Entity) is a stalk or stem or trunk body-part of plant x₂ (Entity)
stapa	x₁ (Entity) steps or treads on surface x₂ (Entity) using limbs x₃ (Entity)
stasu	x₁ (Group<Entity>) is a quantity of soup or stew with ingredients including x₂ (Group<Entity>)
stati	x₁ (Entity) has a talent or aptitude for doing or being x₂ (ka, Property of x₁ or nu, Event)
steba	x₁ (Entity) feels frustration about x₂ (Abstraction)
steci	x₁ (ka, Property of x₂) is specific or particular or defining property of x₂ (Entity) among set x₃ (Set<Entity>)
stedu	x₁ (Entity) is a head body-part of x₂ (Organism)
stela	x₁ (Entity) is a lock or seal of or for sealing x₂ (Entity) with mechanism x₃ (Entity)
stero	x₁ (Entity) is x₂ (Number) steradians in solid angle by standard x₃ (si'o, Standard)
stici	x₁ (Entity) is to the west of x₂ (Entity) according to frame x₃ (Entity)
stidi	x₁ (Entity) suggests or proposes idea or action x₂ (Entity or nu, Event) to audience x₃ (Entity or Group<Entity>)
stika	x₁ (nu, Event) adjusts or regulates or changes property or amount x₂ (ka, Property of x₁) in degree x₃ (Entity)
stizu	x₁ (Entity) is a chair or stool or seat or bench
stodi	x₁ (Entity) is constant or unchanging in property x₂ (ka, Property of x₁) in response to conditions x₃ (nu, Event)
stuna	x₁ (Entity) is to the east of x₂ (Entity) according to frame x₃ (Entity)
stura	x₁ (Entity) is a structure or arrangement or organization of x₂ (Entity or Set<Entity>)
stuzi	x₁ (Location) is an inherent site or place or position or location of x₂ (Entity or nu, Event)
sucta	x₁ (si'o, Idea) is abstracted or generalized from x₂ (Entity) by rules x₃ (Entity)
sudga	x₁ (Entity) is dry of liquid x₂ (Entity)
sufti	x₁ (Entity) is a hoof body-part of x₂ (Organism)
suksa	x₁ (nu, Event or State) is sudden or sharply changes at point x₂ (ka, Property of x₂) in process x₃ (ka, Property of x₂)
sumji	x₁ (Number) is the sum of x₂ (Number) and x₃ (Number)
sumne	x₁ (Entity) smells x₂ (Entity)
sumti	x₁ (Text) is an argument of predicate or function x₂ (Entity or Text) filling place x₃ (Text)
sunga	x₁ (Entity) is a quantity of garlic of species x₂ (Taxon)
sunla	x₁ (Entity) is a quantity of or made from or consists of wool from animal x₂ (Organism)
surla	x₁ (Entity) relaxes or rests by doing x₂ (ka, Property of x₁ or nu, Event)
sutra	x₁ (Entity) is fast or swift or quick at doing or bringing about x₂ (nu, Event or State)
tabno	x₁ (Entity) is a quantity of or contains or is made of carbon of composition including x₂ (Entity)
tabra	x₁ (Entity) is a horn or trumpet or trombone or bugle musical instrument
tadji	x₁ (nu, Process) is a method or technique or approach for doing x₂ (nu, Event) under conditions x₃ (nu, Event)
tadni	x₁ (Entity) studies subject x₂ (Entity)
tagji	x₁ (Entity) is snug or tight on x₂ (Entity) in dimension x₃ (Entity) at locus x₄ (Entity)
talsa	x₁ (Entity) challenges x₂ (Entity) at property x₃ (ka, Property of x₂)
tamca	x₁ (Entity) is a tomato fruit or plant of species x₂ (Taxon)
tamji	x₁ (Entity) is a thumb or big toe body-part on limb x₂ (Entity) of x₃ (Entity)
tamne	x₁ (Entity) is a cousin to x₂ (Entity) by bond x₃ (Entity)
tanbo	x₁ (Entity) is a board or plank shape of material x₂ (Entity)
tance	x₁ (Entity) is a tongue body-part of x₂ (Organism)
tanjo	x₁ (Number) is the trigonometric tangent of angle x₂ (Number)
tanko	x₁ (Entity) is a quantity of tobacco leaf of species x₂ (Taxon)
tanru	x₁ (Text) is a binary metaphor formed with x₂ (Text or si'o, Idea) modifying x₃ (Text or si'o, Idea) giving meaning x₄ (Entity) in usage x₅ (Entity)
tansi	x₁ (Entity) is a pan or basin or tub or sink shallow container for contents x₂ (Entity) of material x₃ (Entity)
tanxe	x₁ (Entity) is a box or carton or trunk or crate for contents x₂ (Entity) of material x₃ (Entity)
tapla	x₁ (Entity) is a tile or cake shape of material x₂ (Entity) with shape x₃ (Entity) and thickness x₄ (Entity)
tarbi	x₁ (Entity) is an embryo or zygote or fetus or fertilized egg with mother x₂ (Entity) and father x₃ (Entity)
tarci	x₁ (Entity) is a star or sun with stellar properties x₂ (Entity)
tarla	x₁ (Entity) is a quantity of or contains or is made of tar or asphalt from source x₂ (Entity)
tarmi	x₁ (Entity or si'o, Idea) is the conceptual shape or form of object or abstraction x₂ (Entity or Abstraction)
tarti	x₁ (Entity) behaves as manner x₂ (ka, Property of x₁ or nu, Event) under conditions x₃ (nu, Event)
taske	x₁ (Entity) thirsts for x₂ (Entity)
tatpi	x₁ (Entity) is tired or fatigued by effort x₂ (nu, Event)
tatru	x₁ (Entity) is a breast or mammary or teat body-part of x₂ (Organism)
tavla	x₁ (Entity) talks or speaks to x₂ (Entity) about subject x₃ (Entity or Text) in language x₄ (Language)
taxfu	x₁ (Entity) is a garment or clothing for wearing by x₂ (Entity) serving purpose x₃ (nu, Event)
tcaci	x₁ (Entity) is a custom or habit of x₂ (Entity) under conditions x₃ (nu, Event)
tcadu	x₁ (Location) is a town or city of metropolitan area x₂ (Location) in political unit x₃ (Entity) serving region x₄ (Location)
tcana	x₁ (Entity) is a station or node of system x₂ (Entity)
tcati	x₁ (Entity) is a quantity of or contains or is made of tea brewed from leaves x₂ (Entity)
tcena	x₁ (Entity) stretches or extends to range x₂ (Entity) in dimension x₃ (Entity) from relaxed range x₄ (Entity)
tcica	x₁ (nu, Event or Experience) misleads or deceives x₂ (Entity) into x₃ (nu, Event or State)
tcidu	x₁ (Entity) reads text x₂ (Text) from surface x₃ (Entity)
tcika	x₁ (Entity) is the time of state or event x₂ (nu, Event) on day x₃ (TimeInterval) at location x₄ (Location)
tcila	x₁ (Entity) is a detail or feature of x₂ (Entity)
tcima	x₁ (Entity) is weather at place x₂ (Location)
tcini	x₁ (ka, Property of x₂) is a situation or condition or circumstance of x₂ (nu, Event)
tcita	x₁ (Entity) is a label or tag of x₂ (Entity) showing information x₃ (ka, Property of x₂ or du'u, Proposition)
temci	x₁ (TimeInterval) is the time-duration or interval or period from time or event x₂ (nu, Event) to time or event x₃ (nu, Event)
tenfa	x₁ (Number) is the exponential result of base x₂ (Number) to power or exponent x₃ (Number)
tengu	x₁ (ka, Property of x₂) is a texture of x₂ (Entity)
terdi	x₁ (Location) is the Earth or home planet of race x₂ (Taxon or Group<Organism>)
terpa	x₁ (Entity) fears x₂ (Entity or nu, Event); x₂ is fearsome or frightening to x₁
terto	x₁ (Entity) is a trillion [10^12] in property x₂ (ka, Property of x₁) in dimension x₃ (ka, Property of x₁)
tigni	x₁ (Entity) performs performance x₂ (nu, Event) for or before audience x₃ (Entity or Group<Entity>)
tikpa	x₁ (Entity) kicks or hits with x₁'s foot or feet x₄ (Entity) object or target x₂ (Entity) at locus x₃ (Entity)
tilju	x₁ (Entity) is heavy or weighty in mass or weight by standard x₂ (si'o, Standard)
tinbe	x₁ (Entity) obeys or follows command or rule x₂ (Entity) made by x₃ (Entity)
tinci	x₁ (Entity) is a quantity of or contains or is made of tin of composition including x₂ (Entity)
tinsa	x₁ (Entity) is stiff or rigid or inflexible or resistant in direction x₂ (Entity) against force x₃ (Entity) under conditions x₄ (nu, Event or State)
tirna	x₁ (Entity) hears sound x₂ (Sound or Entity) against background or noise x₃ (Entity)
tirse	x₁ (Entity) is a quantity of or contains or is made of iron of composition including x₂ (Entity)
tirxu	x₁ (Organism) is a tiger or leopard or jaguar or tigress of species or breed x₂ (Taxon) with coat markings x₃ (ka, Property of x₁)
tisna	x₁ (Entity) fills or becomes stuffed or inflates or blows up with material x₂ (Entity); x₂ pours into x₁
titla	x₁ (Entity) is sweet or sugary or saccharine to observer x₂ (Entity)
tivni	x₁ (Entity) broadcasts or televises programming x₂ (Entity or nu, Event) via medium or channel x₃ (Entity) to television receiver x₄ (Entity)
tixnu	x₁ (Organism) is a daughter of mother or father or parents x₂ (Organism or Group<Organism>)
toknu	x₁ (Entity) is an oven enclosing contents x₂ (Entity) for baking or heating or drying
toldi	x₁ (Organism) is a butterfly or moth of species or breed x₂ (Taxon)
tonga	x₁ (Sound) is a tone or note of frequency or pitch x₂ (Number) from source x₃ (Entity)
tordu	x₁ (Entity) is short in dimension or direction x₂ (ka, Property of x₁) by measurement standard x₃ (si'o, Standard)
torni	x₁ (Entity) twists under load or force or torsion x₂ (Entity)
traji	T: Entity. x₁ (T) is superlative in property x₂ (ka, Property of x₁), at extreme x₃ (ka, Property of x₁) among set or range x₄ (Set<T>)
trano	x₁ (Entity) is a quantity of or contains or is made of nitrogen or ammonia or nitrates
trati	x₁ (Entity) is taut or tense or strained tight in direction x₂ (Entity)
trene	x₁ (Entity) is a train or vehicle x₁ consisting of cars or units x₂ (Group<Entity>) on rails or system or railroad x₃ (Entity) propelled by x₄ (Entity)
tricu	x₁ (Organism) is a tree of species or cultivar x₂ (Taxon)
trina	x₁ (Entity) attracts or appeals to or lures x₂ (Entity or nu, Event) with property or quality x₃ (ka, Property of x₂)
trixe	x₁ (Entity) is posterior or behind or in the rear of x₂ (Entity) which faces in frame of reference x₃ (Entity)
troci	x₁ (Entity) tries or attempts or makes an effort to do or attain x₂ (ka, Property of x₁) by actions or method x₃ (ka, Property of x₁)
tsali	x₁ (Entity) is strong or powerful or tough in property or quality x₂ (ka, Property of x₁) by standard x₃ (si'o, Standard)
tsani	x₁ (Entity) is an expanse of sky or the heavens at place x₂ (Location)
tsapi	x₁ (Entity) is a seasoning or condiment or spice causing flavor or effect x₂ (ka, Property of x₁)
tsiju	x₁ (Entity) is a seed or spore body-part x₁ of organism x₂ (Organism) for producing offspring x₃ (Organism or Group<Organism>)
tsina	x₁ (Entity) is a stage or platform or dais or scaffold at or in location x₂ (Location) supporting x₃ (Entity or nu, Event) made of material x₄ (Entity)
tubnu	x₁ (Entity) is a length of tubing or pipe or hollow cylinder of material x₂ (Entity) with hollow of material x₃ (Entity)
tugni	x₁ (Entity) agrees with persons or position or side x₂ (Entity or Text) that x₃ (du'u, Proposition) is true about matter x₄ (Entity or nu, Event)
tujli	x₁ (Entity) is a tulip of species or strain x₂ (Taxon)
tumla	x₁ (Location) is a parcel or expanse of land at location x₂ (Location)
tunba	x₁ (Entity) is a sibling of x₂ (Entity) by bond or tie or standard or parents x₃ (Entity)
tunka	x₁ (Entity) is made of or contains or is a quantity of copper of composition including x₂ (Entity)
tunlo	x₁ (Entity) gulps or swallows substance x₂ (Entity)
tunta	x₁ (Entity) pokes or jabs or stabs or prods x₂ (Entity) with object x₁ (Entity) usually pointed
tuple	x₁ (Entity) is a leg body-part of x₂ (Organism)
turni	x₁ (Entity) governs or rules people or territory or domain or subjects x₂ (Entity or Group<Entity>)
tutci	x₁ (Entity) is a tool or utensil or resource or instrument or implement used for doing x₂ (nu, Event or Process)
tutra	x₁ (Location) is territory or domain or space of or belonging to or controlled by x₂ (Entity)
vacri	x₁ (Entity) is a quantity of air or normally gaseous atmosphere of planet x₂ (Entity) of composition including x₃ (Entity)
vajni	x₁ (ka, Property of x₂) is the important or significant value or worth of x₂ (Entity or Abstraction) to x₃ (Entity) in aspect or for reason x₄ (ka, Relation<x₁, x₃>)
valsi	x₁ (Text) is a word meaning or causing x₂ (Entity or Abstraction) in language x₃ (Language)
vamji	x₁ (ka, Property of x₂) is the equivalent value or worth of item x₂ (ka, Property of x₃) to x₃ (Entity) for use or appreciation x₄ (ka, Property of x₃)
vamtu	x₁ (Organism) vomits or regurgitates x₂ (Entity)
vanbi	x₁ (Entity or Set<Entity>) is part of an environment or surroundings or context or ambience of x₂ (Entity)
vanci	x₁ (TimeInterval) is an evening of day x₂ (TimeInterval) at location x₃ (Location)
vanju	x₁ (Entity) is made of or contains or is a quantity of wine from fruit or grapes x₂ (Taxon or Entity)
vasru	x₁ (Entity) contains or holds or encloses or includes contents x₂ (Entity) within
vasxu	x₁ (Organism) breathes or respires gas x₂ (Entity)
vecnu	x₁ (Entity) sells or vends goods or service or commodity x₂ (ka, Property of x₁) to buyer x₃ (Entity) for amount or cost or expense x₄ (ka, Property of x₂)
venfu	x₁ (Entity) takes revenge on or retaliates against x₂ (Entity) for wrong x₃ (nu, Event) with vengeance x₄ (nu, Event)
vensa	x₁ (TimeInterval) is spring or springtime of year x₂ (TimeInterval) at location x₃ (Location)
verba	x₁ (Organism) is a child or kid or juvenile of age x₂ (TimeInterval) immature by standard x₃ (si'o, Standard)
vibna	x₁ (Entity) is a vagina body-part of x₂ (Organism)
vidni	x₁ (Entity) is a video monitor or CRT or screen serving function x₂ (ka, Property of x₁)
vidru	x₁ (Organism) is a virus of species or breed or defining property x₂ (Taxon or ka, Property of x₁) capable of infecting at locus x₃ (Entity)
vifne	x₁ (Entity) is fresh or unspoiled
vikmi	x₁ (Organism) excretes waste x₂ (Entity) from source x₃ (Entity) via means or route x₄ (Entity)
viknu	x₁ (Entity) is thick or viscous under conditions x₂ (nu, State)
vimcu	x₁ (Entity) removes or subtracts or deducts or takes away x₂ (Entity) from x₃ (Entity) with or leaving result or remnant or remainder x₄ (Entity)
vindu	x₁ (Entity) is poisonous or venomous or toxic or a toxin to x₂ (Entity)
vinji	x₁ (Entity) is an airplane or aircraft for carrying passengers or cargo x₂ (Entity or Group<Entity>) propelled by x₃ (Entity)
vipsi	x₁ (Entity) is a deputy or vice or subordinate in aspect or organization principle x₂ (ka, Relation<x₁, x₃>) to principal x₃ (Entity)
virnu	x₁ (Entity) is brave or valiant or courageous in activity x₂ (ka, Property of x₁) by standard x₃ (si'o, Standard)
viska	x₁ (Entity) sees or views or perceives visually x₂ (Entity) under conditions x₃ (Entity)
vitci	x₁ (Entity) is irregular or occasional or intermittent in property or action or aspect x₂ (ka, Property of x₁)
vitke	x₁ (Entity) is a guest or visitor of x₂ (Entity) at place or event x₃ (Location or nu, Event)
vitno	x₁ (Entity) is permanent or lasting or eternal in property x₂ (ka, Property of x₁) by standard x₃ (si'o, Standard)
vlagi	x₁ (Entity) is a vulva body-part of x₂ (Organism)
vlile	x₁ (nu, Event or State) is an event or state or act of violence
vlina	x₁ (Entity) is a logical alternation or disjunction stating that x₂ (du'u, Proposition) and or x₃ (du'u, Proposition) is or are true
vlipa	x₁ (Entity) has the power to bring about x₂ (nu, Event) under conditions x₃ (nu, Event or State)
vofli	x₁ (Entity) flies in air or atmosphere using lifting or propulsion means x₂ (Entity)
voksa	x₁ (Sound) is a voice or speech sound of individual x₂ (Entity)
vorme	x₁ (Entity) is a doorway or gateway or access way between x₂ (Location) and x₃ (Location) of structure x₄ (Entity)
vraga	x₁ (Entity) is a lever tool of apparatus for doing function or action x₂ (nu, Event) with fulcrum x₃ (Entity) and arm x₄ (Entity)
vreji	x₁ (Entity) is a record of data or facts or proposition x₂ (du'u, Proposition) about object or event x₃ (Entity or nu, Event) preserved in medium x₄ (Entity)
vreta	x₁ (Entity) lies or rests or reclines or reposes on x₂ (Entity)
vrici	x₁ (Set<Entity>) is miscellaneous or various or assorted in property x₂ (ka, Property of each member of x₂)
