word	definition
cuxna	x₁ (Entity) chooses or selects choice x₂ (Entity) from complete set or sequence of alternatives x₃ (Set<Entity> or Sequence<Entity>)
dacru	x₁ (Entity) is a drawer or sliding compartment in structure x₂ (Entity) for contents x₃ (Entity)
dacti	x₁ (Object) is a material object enduring in space-time
dadjo	x₁ (Entity) pertains to Taoist culture or ethos or religion in aspect x₂ (ka, Property of x₁)
dakfu	x₁ (Entity) is a knife tool for cutting x₂ (Entity) with blade of material x₃ (Entity)
dakli	x₁ (Entity) is a sack or bag with contents x₂ (Entity) made of material x₃ (Entity)
damba	x₁ (Entity) fights or combats or struggles with x₂ (Entity) over issue x₃ (Abstraction)
damri	x₁ (Entity) is a drum or cymbal or gong percussion instrument with beater or actuator x₂ (Entity)
dandu	x₁ (Entity) hangs or dangles or is suspended from x₂ (Entity) by joint x₃ (Entity)
danfu	x₁ (Entity) is the answer or response or solution or reply to question or problem x₂ (Entity or du'u, Proposition)
danlu	x₁ (Organism) is an animal or creature of species x₂ (Taxon)
danmo	x₁ (Entity) is a quantity of or contains or is made of smoke or smog or air pollution from source x₂ (Entity)
danre	x₁ (Entity or Force) puts pressure on or presses or applies force to x₂ (Entity)
dansu	x₁ (Entity or Group<Entity>) dances to accompaniment or music or rhythm x₂ (Sound or Text)
danti	x₁ (Entity) is a ballistic projectile such as bullet or missile for firing by gun or launcher x₂ (Entity)
daplu	x₁ (Location) is an island or atoll or key of material or properties x₂ (Entity) in surroundings or body x₃ (Entity)
dapma	x₁ (Entity) curses or damns or condemns x₂ (Entity) to fate x₃ (nu, Event)
dargu	x₁ (Entity) is a road or highway to x₂ (Location) from x₃ (Location) with route x₄ (Entity)
darlu	x₁ (Entity) argues for stand x₂ (du'u, Proposition) against stand x₃ (du'u, Proposition)
darno	x₁ (Entity) is far or distant from x₂ (Entity) in property x₃ (ka, Relation<x₁, x₂>)
darsi	x₁ (Entity) shows audacity or boldness in behavior x₂ (nu, Event or ka, Property of x₁)
darxi	x₁ (Entity) hits or strikes or beats x₂ (Entity) with instrument or body-part x₃ (Entity) at locus x₄ (Entity)
daski	x₁ (Entity) is a pocket or pouch of or in garment or item x₂ (Entity)
dasni	x₁ (Entity) wears garment x₂ (Entity) as garment of type x₃ (ka, Property of x₁)
daspo	x₁ (nu, Event) destroys or ruins or wrecks or despoils x₂ (Entity)
dasri	x₁ (Entity) is a ribbon or tape or strip or band of material x₂ (Entity)
datka	x₁ (Organism) is a duck of species x₂ (Taxon)
datni	x₁ (du'u, Proposition) is data or information or statistics about x₂ (Entity) gathered by method x₃ (nu, Event)
decti	x₁ (Entity) is one tenth in property x₂ (ka, Property of x₁) in dimension x₃ (ka, Property of x₁)
degji	x₁ (Entity) is a finger or digit or toe body-part on limb or body site x₂ (Entity) of body x₃ (Entity)
dejni	x₁ (Entity) owes debt x₂ (Entity) to creditor x₃ (Entity) in return for service or loan x₄ (Entity or nu, Event)
dekpu	x₁ (Entity) is x₂ (Number) local volume units in dimension x₃ (ka, Property of x₁) by standard x₄ (si'o, Standard) with subunits x₅ (Entity)
dekto	x₁ (Entity) is ten in property x₂ (ka, Property of x₁) in dimension x₃ (ka, Property of x₁)
delno	x₁ (Entity) is x₂ (Number) candela in luminosity by standard x₃ (si'o, Standard)
dembi	x₁ (Entity) is a bean or pea or leguminous seed from plant x₂ (Entity)
denci	x₁ (Entity) is a tooth body-part of x₂ (Organism)
denmi	x₁ (Entity) is dense or concentrated or packed or intense in property x₂ (ka, Property of x₁) at location x₃ (Entity)
denpa	x₁ (Entity) waits or pauses for x₂ (nu, Event) at state x₃ (nu, Event) before doing or continuing x₄ (nu, Event)
dertu	x₁ (Entity) is a quantity of or contains or is made of dirt or soil or earth or ground from source x₂ (Entity) of composition x₃ (Entity)
derxi	x₁ (Entity) is a heap or pile or stack or mound or hill of materials x₂ (Entity) at location x₃ (Location)
desku	x₁ (Entity) shakes or quakes or trembles or quivers or shudders or wobbles or vibrates from force x₂ (nu, Event or Entity)
detri	x₁ (Entity) is the date of event or state x₂ (nu, Event) at location x₃ (Location) by calendar x₄ (Entity)
dicra	x₁ (nu, Event) interrupts or stops or halts or disrupts x₂ (Entity or nu, Event) due to quality x₃ (ka, Property of x₁)
dikca	x₁ (Entity) is electricity electric charge or current in or on x₂ (Entity) of polarity or quantity x₃ (Number)
diklo	x₁ (Entity) is local to locus x₂ (Entity) within range x₃ (Entity)
dikni	x₁ (Entity) is regular or cyclical or periodic in property or activity x₂ (ka, Property of x₁ or nu, Event) with period or interval x₃ (Entity)
dilcu	x₁ (Number) is the quotient x₂ (Number) divided by x₃ (Number) leaving remainder x₄ (Number)
dilnu	x₁ (Entity) is a cloud or mass of clouds of material x₂ (Entity) in air mass x₃ (Entity) at base elevation x₄ (Entity or Number)
dimna	x₁ (nu, Event) is a fate or destiny of x₂ (Entity)
dinju	x₁ (Location) is a building or edifice for purpose x₂ (nu, Event)
dinko	x₁ (Entity) is a nail or tack fastener of type or size x₂ (ka, Property of x₁) made of material x₃ (Entity)
dirba	x₁ (ka, Property of x₂) is dear or precious or darling to x₂ (Entity)
dirce	x₁ (Entity) radiates or emits x₂ (Entity) under conditions x₃ (nu, Event)
dirgo	x₁ (Entity) is a drop of material x₂ (Entity) in surrounding material x₃ (Entity)
dizlo	x₁ (Entity) is low or downward in frame of reference x₂ (Entity) compared with baseline or standard height x₃ (Entity)
djacu	x₁ (Entity) is a quantity of or contains or is made of water
djedi	x₁ (TimeInterval) is x₂ (Number) full days in duration by standard x₃ (si'o, Standard)
djica	x₁ (Entity) desires or wants or wishes x₂ (nu, Event or State) for purpose x₃ (nu, Event)
djine	x₁ (Entity) is a ring or annulus or torus or circle shape of material x₂ (Entity) with inside diameter x₃ (Number) and outside diameter x₄ (Number)
djuno	x₁ (Entity) knows fact x₂ (du'u, Proposition) about subject x₃ (Entity) by epistemology x₄ (du'u, Proposition)
donri	x₁ (TimeInterval) is the daytime of day x₂ (TimeInterval) at location x₃ (Location)
dotco	x₁ (Entity) reflects German or Germanic culture or nationality or language in aspect x₂ (ka, Property of x₁)
draci	x₁ (Entity) is a drama or play about x₂ (Entity) by dramatist x₃ (Entity) for audience x₄ (Entity or Group<Entity>) with actors x₅ (Group<Entity>)
drani	x₁ (Entity) is correct or proper or right or perfect in property or aspect x₂ (ka, Property of x₁) in situation x₃ (nu, Event) by standard x₄ (Entity)
drata	x₁ (Entity) is different from or other than x₂ (Entity) by standard x₃ (si'o, Standard)
drudi	x₁ (Entity) is a roof or top or ceiling or lid of x₂ (Entity)
dugri	x₁ (Number) is the logarithm of x₂ (Number) to base x₃ (Number)
dukse	T: Entity. x₁ (T) is an excess of or too much of x₂ (T) by standard x₃ (si'o, Standard)
dukti	x₁ (Entity) is a polar opposite or contrary to x₂ (Entity) in property or on scale x₃ (ka, Relation<x₁, x₂> or si'o, Scale)
dunda	x₁ (Entity) gives or donates gift x₂ (ka, Property of x₃) to recipient x₃ (Entity) without payment or exchange
dunja	x₁ (Entity) freezes or jells or solidifies at temperature x₂ (Number) and pressure x₃ (Number)
dunku	x₁ (Entity) is anguished or distressed or emotionally wrought or stressed by x₂ (nu, Event)
dunli	T: Entity. x₁ (T) is equal or congruent to or as much as x₂ (T) in property or dimension or quantity x₃ (ka, Relation<x₁, x₂>)
dunra	x₁ (TimeInterval) is winter season of year x₂ (Entity or Number) at location x₃ (Location)
dzena	x₁ (Entity) is an elder or ancestor of x₂ (Entity) by bond or degree x₃ (Entity)
dzipo	x₁ (Entity) reflects Antarctican culture or nationality or geography in aspect x₂ (ka, Property of x₁)
facki	x₁ (Entity) discovers or finds out fact x₂ (du'u, Proposition) about subject or object x₃ (Entity)
fadni	x₁ (Entity) is ordinary or common or typical or usual in property x₂ (ka, Property of x₁) among members of set x₃ (Set<Entity>)
fagri	x₁ (Entity) is a fire or flame in fuel x₂ (Entity) burning in or reacting with oxidizer x₃ (Entity)
falnu	x₁ (Entity) is a sail for gathering propelling material x₂ (Entity) on vehicle or motor x₃ (Entity)
famti	x₁ (Entity) is an aunt or uncle of x₂ (Entity) by bond x₃ (Entity)
fancu	x₁ (Entity) is a function mapping domain x₂ (Entity) to range x₃ (Entity) defined by expression or rule x₄ (Text)
fange	x₁ (Entity) is foreign or alien or exotic or unfamiliar to x₂ (Entity) in property x₃ (ka, Property of x₁)
fanmo	x₁ (Entity or State) is an end or finish or termination of thing or process x₂ (Entity or nu, Event)
fanri	x₁ (Entity) is a factory or foundry or industrial plant or mill producing x₂ (Entity) from materials x₃ (Entity)
fanta	x₁ (Entity) prevents or keeps or stops or restrains event x₂ (nu, Event) from occurring
fanva	x₁ (Entity) translates text or utterance x₂ (Text) to language x₃ (Language) from language x₄ (Language) with translation result x₅ (Text)
fanza	x₁ (nu, Event) annoys or irritates or bothers or distracts x₂ (Entity)
fapro	x₁ (Entity) opposes or balances or contends against opponent(s) x₂ (Entity or Group<Entity>) about x₃ (Abstraction)
farlu	x₁ (Entity) falls or drops to x₂ (Location) from x₃ (Location) in gravity well or frame x₄ (Entity)
farna	x₁ (Entity) is the direction of x₂ (Entity or nu, Event) from origin or in frame of reference x₃ (Entity)
farvi	x₁ (Entity) develops or evolves towards or into x₂ (Entity) from x₃ (Entity) through stages x₄ (Sequence<Entity> or Group<Entity>)
fasnu	x₁ (nu, Event) is an event or incident or happening or occurrence
fatci	x₁ (du'u, Proposition) is a fact or reality or truth or actuality
fatne	x₁ (Sequence<Entity>) is in reverse order from sequence x₂ (Sequence<Entity>) or x₁ (Entity) is inverted from x₂ (Entity)
fatri	x₁ (Entity) is distributed or allotted or allocated or shared among x₂ (Entity or Group<Entity>) with shares or portions x₃ (Entity or Group<Entity>)
febvi	x₁ (Entity) boils or evaporates at temperature x₂ (Number) and pressure x₃ (Number)
femti	x₁ (Entity) is 10^-15 in property x₂ (ka, Property of x₁) in dimension x₃ (ka, Property of x₁)
fendi	x₁ (Entity) divides or partitions or separates x₂ (Entity) into parts or individuals x₃ (Entity or Group<Entity>) by method or partition x₄ (Entity or du'u, Proposition)
fengu	x₁ (Entity) is angry or mad at x₂ (Entity) for x₃ (ka, Property of x₂)
fenki	x₁ (nu, Event) is crazy or insane or frantic by standard x₂ (si'o, Standard)
fenra	x₁ (Entity) is a crack or fissure or pass or cleft or ravine or chasm in x₂ (Entity)
fenso	x₁ (Entity) sews or stitches or sutures materials x₂ (Entity or Set<Entity>) together with tool(s) x₃ (Entity) using filament x₄ (Entity)
fepni	x₁ (Entity) is x₂ (Number) cents or copecks in value in monetary system x₃ (Entity)
fepri	x₁ (Entity) is a lung body-part of x₂ (Organism)
ferti	x₁ (Entity) is fertile or conducive for supporting growth or development of x₂ (Entity or ka, Property of x₁)
festi	x₁ (Entity) is waste product left by event or activity x₂ (nu, Event)
fetsi	x₁ (Organism) is a female of species x₂ (Taxon) with feminine traits x₃ (ka, Property of x₁)
figre	x₁ (Entity) is a fig fruit or tree of species x₂ (Taxon)
filso	x₁ (Entity) reflects Palestinian culture or nationality in aspect x₂ (ka, Property of x₁)
finpe	x₁ (Organism) is a fish of species x₂ (Taxon)
finti	x₁ (Entity) invents or creates or composes or authors x₂ (Entity) for purpose x₃ (Entity or nu, Event) from existing elements or ideas x₄ (Entity)
flalu	x₁ (Entity) is a law specifying x₂ (ka, Property of x₃) for community x₃ (Group<Entity>) under conditions x₄ (nu, Event) by lawgiver x₅ (Entity)
flani	x₁ (Entity) is a flute or pipe or fife or recorder musical instrument
flecu	x₁ (Entity) is a current or flow or river of or in fluid x₂ (Entity) flowing towards x₃ (Location) from source x₄ (Location)
fliba	x₁ (Entity) fails at doing x₂ (ka, Property of x₁)
flira	x₁ (Entity) is a face head body-part of x₂ (Organism)
foldi	x₁ (Entity) is a field broad uniform expanse of material x₂ (Entity)
fonmo	x₁ (Entity) is a quantity of foam or froth or suds of material x₂ (Entity) with bubbles of material x₃ (Entity)
fonxa	x₁ (Entity) is a telephone transceiver or modem attached to system or network x₂ (Entity)
forca	x₁ (Entity) is a fork tool or utensil for purpose x₂ (nu, Event) with tines or prongs x₃ (Entity) on base or support x₄ (Entity)
fraso	x₁ (Entity) reflects French or Gallic culture or nationality or language in aspect x₂ (ka, Property of x₁)
frati	x₁ (Entity) reacts or responds or answers with action x₂ (ka, Property of x₁) to stimulus x₃ (Entity or nu, Event) under conditions x₄ (nu, Event)
fraxu	x₁ (Entity) forgives x₂ (Entity) for event or state or activity x₃ (nu, Event)
frica	x₁ (Entity) differs or is distinct from x₂ (Entity) in property or dimension or quantity x₃ (ka, Relation<x₁, x₂>)
friko	x₁ (Entity) reflects African culture or nationality or geography in aspect x₂ (ka, Property of x₁)
frili	x₁ (nu, Event) is easy or simple or facile for agent x₂ (Entity) under conditions x₃ (nu, Event)
frinu	x₁ (Entity) is a fraction with numerator x₂ (Number) and denominator x₃ (Number)
friti	x₁ (Entity) offers or proffers x₂ (ka, Property of x₃) to x₃ (Entity) with conditions x₄ (nu, Event)
frumu	x₁ (Entity) frowns or grimaces
fukpi	x₁ (Entity) is a copy or replica or duplicate or clone of x₂ (Entity) in form or medium x₃ (Entity) made by method x₄ (nu, Event)
fulta	x₁ (Entity) floats on or in fluid x₂ (Entity)
funca	x₁ (ka, Property of x₂) is determined by the luck or fortune of x₂ (Entity)
fusra	x₁ (Entity) rots or decays or ferments with decay or fermentation agent x₂ (Entity)
fuzme	x₁ (Entity) is responsible or accountable for x₂ (nu, Event or State) to judge or authority x₃ (Entity)
gacri	x₁ (Entity) is a cover or lid or top for covering or concealing or sheltering x₂ (Entity)
gadri	x₁ (Text) is an article or descriptor labelling description x₂ (Text) in language x₃ (Entity) with semantics x₄ (Entity)
galfi	x₁ (nu, Event) modifies or alters or changes or transforms or converts x₂ (Entity) into x₃ (Entity)
galtu	x₁ (Entity) is high or upward in frame of reference x₂ (Entity) compared with baseline or standard height x₃ (Entity)
galxe	x₁ (Entity) is a throat or gullet body-part of x₂ (Organism)
ganlo	x₁ (Entity) is a portal or passage or entrance-way that is closed or shut preventing passage or access to x₂ (Entity) by x₃ (Entity)
ganra	x₁ (Entity) is broad or wide in dimension x₂ (ka, Property of x₁) by standard x₃ (si'o, Standard)
ganse	x₁ (Entity) senses or detects or notices stimulus x₂ (Entity or nu, Event) by means x₃ (Entity) under conditions x₄ (nu, Event)
ganti	x₁ (Entity) is a gonad or testes or ovary body-part of x₂ (Organism) of sex x₃ (Entity)
ganxo	x₁ (Entity) is an anus or anal orifice body-part of x₂ (Organism)
ganzu	x₁ (Entity) organizes x₂ (Entity or Group<Entity>) into ordered result x₃ (Entity or Group<Entity>) by system or principle(s) x₄ (du'u, Proposition)
gapci	x₁ (Entity) is gaseous or a gas or vapor of material including x₂ (Entity) under conditions x₃ (nu, Event)
gapru	x₁ (Entity) is directly or vertically above x₂ (Entity) in gravity or frame x₃ (Entity)
garna	x₁ (Entity) is a rail or railing or bar supporting or restraining x₂ (Entity) made of material x₃ (Entity)
gasnu	x₁ (Entity) as agent brings about event x₂ (nu, Event)
gasta	x₁ (Entity) is a quantity of or is made of or contains steel of composition including x₂ (Entity)
genja	x₁ (Entity) is a root body-part of plant or species x₂ (Taxon)
gento	x₁ (Entity) reflects Argentinian culture or nationality in aspect x₂ (ka, Property of x₁)
genxu	x₁ (Entity) is a hook or crook shape of material x₂ (Entity)
gerku	x₁ (Organism) is a dog or canine of species x₂ (Taxon)
gerna	x₁ (Entity) is the grammar or rules or defining form of language x₂ (Entity) for structure or text x₃ (Text)
gidva	x₁ (Entity or nu, Event) guides or conducts or pilots or leads x₂ (Entity or Group<Entity>) in or at event x₃ (nu, Event)
gigdo	x₁ (Entity) is 10^9 in property x₂ (ka, Property of x₁) in dimension x₃ (ka, Property of x₁)
ginka	x₁ (Location) is a camp or encampment or temporary residence of x₂ (Entity or Group<Entity>) at location x₃ (Location)
girzu	x₁ (Group<Entity>) is a group or cluster or team showing common property x₂ (ka, Property of member of x₁) with members x₃ (Set<Entity>) linked by relations x₄ (Relation<members of x₃>)
gismu	x₁ (Text) is a Lojban root word expressing relation x₂ (Relation<members of x₃>) among argument roles x₃ (Sequence<Entity>) with affixes x₄ (Sequence<Text>)
glare	x₁ (Entity) is hot or warm by standard x₂ (si'o, Standard)
gleki	x₁ (Entity) is happy or merry or glad or gleeful about x₂ (nu, Event or State)
gletu	x₁ (Entity) copulates or mates or has sexual intercourse with x₂ (Entity)
glico	x₁ (Entity) is English or pertains to English-speaking culture in aspect x₂ (ka, Property of x₁)
gluta	x₁ (Entity) is a mitten or glove garment of material x₂ (Entity)
gocti	x₁ (Entity) is 10^-24 in property x₂ (ka, Property of x₁) in dimension x₃ (ka, Property of x₁)
gotro	x₁ (Entity) is 10^24 in property x₂ (ka, Property of x₁) in dimension x₃ (ka, Property of x₁)
gradu	x₁ (Entity) is a unit or degree on scale x₂ (v) measuring property x₃ (ka, Property of x₁)
grake	x₁ (Entity) is x₂ (Number) grams in mass by standard x₃ (si'o, Standard)
grana	x₁ (Entity) is a rod or pole or staff or stick or cane shape of material x₂ (Entity)
grasu	x₁ (Entity) is a quantity of or is made of or contains grease or fat or oil from source x₂ (Entity)
greku	x₁ (Entity) is a frame or structure or skeleton supporting or determining the form of x₂ (Entity)
grusi	x₁ (Entity) is gray in color
grute	x₁ (Entity) is a fruit of species x₂ (Taxon)
gubni	x₁ (Entity) is public or jointly available to community x₂ (Group<Entity>)
gugde	x₁ (Entity) is a country of peoples x₂ (Group<Entity>) with territory x₃ (Location)
gundi	x₁ (Entity) is industry or industrial manufacturing activity producing x₂ (Entity) by process or means x₃ (nu, Event)
gunka	x₁ (Entity) works or labors on activity x₂ (ka, Property of x₁) with goal x₃ (nu, Event)
gunma	x₁ (Group<Entity>) is a mass or team or aggregate together composed of components x₂ (Group<Entity>)
gunro	x₁ (Entity) rolls on or against surface x₂ (Entity) rotating on axis or axle x₃ (Entity)
gunse	x₁ (Organism) is a goose of species x₂ (Taxon)
gunta	x₁ (Entity or Group<Entity>) attacks or invades or commits aggression upon victim x₂ (Entity) with goal x₃ (nu, Event or ka, Property of x₁)
gurni	x₁ (Entity) is grain or cereal from plant or species x₂ (Taxon)
guska	x₁ (Entity) scrapes or erodes or abrades x₂ (Entity) from x₃ (Entity)
gusni	x₁ (Entity) is light or illumination illuminating x₂ (Entity) from light source x₃ (Entity)
gusta	x₁ (Location) is a restaurant or cafe or diner serving type-of-food x₂ (Entity) to audience x₃ (Group<Entity>)
gutci	x₁ (Entity) is x₂ (Number) short local distance units in dimension x₃ (ka, Property of x₁) by standard x₄ (si'o, Standard) with subunits x₅ (Entity)
gutra	x₁ (Entity) is a womb or uterus body-part of x₂ (Organism)
guzme	x₁ (Entity) is a melon or squash fruit or plant of species x₂ (Taxon)
jabre	x₁ (Entity) brakes or causes to slow motion or activity x₂ (Entity or nu, Event) with mechanism or principle x₃ (Entity or du'u, Proposition)
jadni	x₁ (Entity) adorns or decorates x₂ (Entity)
jakne	x₁ (Entity) is a rocket vehicle propelled by jet expelling x₂ (Entity) carrying payload x₃ (Entity)
jalge	x₁ (nu, Event or State) is a result or outcome or conclusion of antecedent x₂ (nu, Event or Process)
jalna	x₁ (Entity) is a quantity of or contains or is made of starch from source x₂ (Entity) of composition including x₃ (Entity)
jalra	x₁ (Organism) is a cockroach or termite or orthopteran of order or species x₂ (Taxon)
jamfu	x₁ (Entity) is a foot body-part of x₂ (Organism)
jamna	x₁ (Entity or Group<Entity>) wars against x₂ (Entity or Group<Entity>) over territory or matter x₃ (du'u, Proposition)
janbe	x₁ (Entity) is a bell or chime or tuning fork producing sound x₂ (Sound)
janco	x₁ (Entity) is a shoulder or hip joint body-part attaching limb x₂ (Entity) to body x₃ (Entity)
janli	x₁ (Entity) collides with or crashes or bumps or runs into x₂ (Entity)
jansu	x₁ (Entity) is a diplomat or consul representing polity x₂ (Entity) in negotiation x₃ (nu, Event) for function or purpose x₄ (nu, Event)
janta	x₁ (Entity) is an account or bill or invoice for goods or services x₂ (Entity or nu, Event) billed to x₃ (Entity) by x₄ (Entity)
jarbu	x₁ (Location) is a suburban area of city or metropolis x₂ (Location)
jarco	x₁ (Entity) shows or exhibits or displays or reveals or demonstrates property x₂ (ka, Property of x₁) to audience x₃ (Entity)
jarki	x₁ (Entity) is narrow in dimension x₂ (ka, Property of x₁) by standard x₃ (si'o, Standard)
jaspu	x₁ (Entity) is a passport issued to person x₂ (Entity) by authority x₃ (Entity) allowing activity x₄ (nu, Event)
jatna	x₁ (Entity) is a captain or commander or leader of vehicle or domain x₂ (Entity)
javni	x₁ (Entity) is a rule prescribing or mandating or requiring event or state x₂ (nu, Event) within system or community x₃ (Entity or Group<Entity>)
jbama	x₁ (Entity) is a bomb or explosive device with explosive material or principle x₂ (Entity)
jbari	x₁ (Entity) is a berry fruit or plant of species x₂ (Taxon)
jbena	x₁ (Entity) is born to parent x₂ (Entity) at time x₃ (TimeInterval) and place x₄ (Location)
jbera	x₁ (Entity) borrows or temporarily takes object x₂ (Entity) from source x₃ (Entity) for interval x₄ (TimeInterval)
jbini	x₁ (Entity) is between or among set or bounds x₂ (Set<Entity>) in property x₃ (ka, Property of x₁)
jdari	x₁ (Entity) is firm or hard or resistant or unyielding to force x₂ (nu, Event or Entity) under conditions x₃ (nu, Event)
jdice	x₁ (Entity) decides decision x₂ (du'u, Proposition) about matter x₃ (nu, Event or State)
jdika	x₁ (Entity) decreases or contracts or is reduced in property or quantity x₂ (ka, Property of x₁) by amount x₃ (Entity or Number)
jdima	x₁ (ka, Property of x₄) is the price of x₂ (ka, Property of x₃) to purchaser x₃ (Entity) set by vendor x₄ (Entity)
jdini	x₁ (Entity) is money or currency issued by x₂ (Entity)
jduli	x₁ (Entity) is a quantity of jelly or semisolid of material including x₂ (Entity)
jecta	x₁ (Entity) is a polity or state governing territory or domain x₂ (Location or Entity)
jeftu	x₁ (TimeInterval) is x₂ (Number) weeks in duration by standard x₃ (si'o, Standard)
jegvo	x₁ (Entity) pertains to Abrahamic common culture or religion or nationality in aspect x₂ (ka, Property of x₁)
jelca	x₁ (Entity) burns or ignites or is flammable at temperature x₂ (Number) in atmosphere x₃ (Entity)
jemna	x₁ (Entity) is a gem or polished stone or pearl of type x₂ (Entity) from material or source x₃ (Entity)
jenca	x₁ (nu, Event) shocks or stuns x₂ (Entity)
jendu	x₁ (Entity) is an axle or spindle tool on which x₂ (Entity) rotates made of material x₃ (Entity)
jenmi	x₁ (Group<Entity>) is an army serving group or community x₂ (Group<Entity>) in function x₃ (nu, Event)
jerna	x₁ (Entity) earns or deserves or merits wages or salary or pay x₂ (ka, Property of x₁) for work or service x₃ (ka, Property of x₁)
jersi	x₁ (Entity) chases or pursues or physically follows after x₂ (Entity)
jerxo	x₁ (Entity) reflects Algerian culture or nationality in aspect x₂ (ka, Property of x₁)
jesni	x₁ (Entity) is a needle pointed shape of material x₂ (Entity)
jetce	x₁ (Entity) is a jet expelled stream of material x₂ (Entity) expelled from x₃ (Entity)
jetnu	x₁ (du'u, Proposition) is true by standard or epistemology or metaphysics x₂ (du'u, Proposition)
jgalu	x₁ (Entity) is a claw or nail or talon body-part of x₂ (Organism)
jganu	x₁ (Entity) is an angle shape from vertex x₂ (Entity) subtended by lateral segment x₃ (Entity)
jgari	x₁ (Entity) grasps or holds or clutches or seizes or grips x₂ (Entity) with body-part x₃ (Entity) at locus x₄ (Entity)
jgena	x₁ (Entity) is a knot or tangle in or between x₂ (Entity or Group<Entity>)
jgina	x₁ (Entity) is a gene of creature x₂ (Organism) determining trait or process x₃ (ka, Property of x₂ or nu, Event)
jgira	x₁ (Entity) feels pride in or about x₂ (Abstraction)
jgita	x₁ (Entity) is a guitar or violin or stringed musical instrument with plectrum or bow x₂ (Entity)
jibni	x₁ (Entity) is near or close to x₂ (Entity) in property or quantity x₃ (ka, Relation<x₁, x₂> or ni)
