word	definition
jibri	x₁ (ka, Property of x₂) is a job or occupation or employment of person x₂ (Entity)
jicla	x₁ (Entity or nu, Event) stirs or mixes or agitates fluid x₂ (Entity)
jicmu	x₁ (Property of x₂) is a basis or foundation or fundamental principle of x₂ (Entity or nu, Event)
jijnu	x₁ (Entity) intuits fact x₂ (du'u, Proposition) about subject x₃ (Entity)
jikca	x₁ (Entity) interacts or behaves socially with x₂ (Entity)
jikru	x₁ (Entity) is a quantity of or is made of or contains liquor distilled from x₂ (Entity)
jilka	x₁ (Entity) is a quantity of or contains or is made of alkali or base of composition including x₂ (Entity)
jilra	x₁ (Entity) is jealous of or envies x₂ (Entity) about property x₃ (ka, Property of x₂)
jimca	x₁ (Entity) is a branch or bough or limb of x₂ (Entity)
jimpe	x₁ (Entity) understands fact x₂ (du'u, Proposition) about subject x₃ (Entity)
jimte	x₁ (Entity) is a limit or extreme or bound or border of x₂ (Entity) in property or domain x₃ (ka, Relation<x₁, x₂>)
jinci	x₁ (Entity) is a pair of shears or scissors for cutting x₂ (Entity)
jinga	x₁ (Entity or Group<Entity>) wins or gains prize x₂ (ka, Property of x₁) from competitors x₃ (Entity or Group<Entity>) in competition x₄ (nu, Event)
jinku	x₁ (Entity) is a vaccine or immune-system stimulant protecting x₂ (Entity) against disease x₃ (nu, Event or ka, Property of x₂) introduced by method x₄ (nu, Event)
jinme	x₁ (Entity) is a quantity of or is made of or contains metal of composition including x₂ (Entity)
jinru	x₁ (Entity) is immersed or submerged or bathes in liquid x₂ (Entity)
jinsa	x₁ (Entity) is clean or pure of material or contaminant x₂ (Entity) by standard x₃ (si'o, Standard)
jinto	x₁ (Location) is a well or spring of fluid x₂ (Entity) at location x₃ (Location)
jinvi	x₁ (Entity) opines that x₂ (du'u, Proposition) is true about subject x₃ (Entity) on grounds x₄ (du'u, Proposition)
jinzi	x₁ (ka, Property of x₂) is an innate or inherent or intrinsic or natural property of x₂ (Entity)
jipci	x₁ (Organism) is a chicken or small fowl of species x₂ (Taxon)
jipno	x₁ (Entity) is a tip or point or vertex or extremity or end on object x₂ (Entity) at locus x₃ (Entity)
jirna	x₁ (Entity) is a horn body-part of x₂ (Organism)
jisra	x₁ (Entity) is a quantity of or is made of or contains juice or nectar from source x₂ (Entity)
jitfa	x₁ (du'u, Proposition) is false or an untruth by standard or epistemology or metaphysics x₂ (du'u, Proposition)
jitro	x₁ (Entity) has control over or manages or directs or conducts x₂ (Entity or Group<Entity>) in activity or event x₃ (nu, Event)
jivbu	x₁ (Entity) weaves x₂ (Entity) from material or yarn x₃ (Entity)
jivna	x₁ (Entity) competes or vies with opponent x₂ (Entity) in contest x₃ (nu, Event) for gain x₄ (Entity or nu, Event)
jmaji	x₁ (Group<Entity>) gathers or collects at location x₂ (Location) from locations x₃ (Group<Entity>)
jmifa	x₁ (Location) is a shoal or reef of material x₂ (Entity) in body of water x₃ (Entity)
jmina	x₁ (Entity) adds or combines x₂ (Entity or ka, Property of x₃) to x₃ (Entity) with result x₄ (Entity or ka, Property of x₃)
jmive	x₁ (Organism) lives or is alive by standard x₂ (si'o, Standard)
jordo	x₁ (Entity) reflects Jordanian culture or nationality in aspect x₂ (ka, Property of x₁)
jorne	x₁ (Entity) is joined to or connects to or is united with x₂ (Entity) at common locus x₃ (Entity)
jubme	x₁ (Entity) is a table with flat upper surface of material x₂ (Entity) supported by legs or base or pedestal x₃ (Entity)
judri	x₁ (Text) is an address or coordinates of x₂ (Entity) in system x₃ (Entity)
jufra	x₁ (Text) is a sentence or statement about topic x₂ (Entity) in language x₃ (Entity)
jukni	x₁ (Organism) is a spider or arachnid or crustacean or crab or non-insect arthropod of species x₂ (Taxon)
jukpa	x₁ (Entity) cooks or prepares food x₂ (Entity) by recipe or method x₃ (nu, Event)
julne	x₁ (Entity) is a net or filter allowing passage of x₂ (Entity) and prohibiting passage of x₃ (Entity) with netting properties x₄ (ka, Property of x₁)
jundi	x₁ (Entity) is attentive towards or attends or pays attention to object or affair x₂ (Entity or nu, Event)
jungo	x₁ (Entity) reflects Chinese culture or nationality or language in aspect x₂ (ka, Property of x₁)
junla	x₁ (Entity) is a clock or watch or timer measuring time units x₂ (Entity) to precision x₃ (Entity) with mechanism x₄ (Entity)
junri	x₁ (Entity) is serious or earnest about x₂ (nu, Event or State)
junta	x₁ (Entity) is the weight of object x₂ (Entity) in field x₃ (Entity)
jurme	x₁ (Organism) is a bacterium or germ or microbe of species or defining property x₂ (Taxon or ka, Property of x₁)
jursa	x₁ (nu, Event or State) is severe or harsh to x₂ (Entity)
jutsi	x₁ (Entity) is a species or taxon of super-taxon x₂ (Entity) and higher taxon x₃ (Entity)
juxre	x₁ (nu, Event) is clumsy or awkward by standard x₂ (si'o, Standard)
jvinu	x₁ (Entity) is a view or scene or panorama or sight of x₂ (Entity or Location) from viewpoint x₃ (Location or Entity)
kabri	x₁ (Entity) is a cup or glass or tumbler or mug or vessel containing contents x₂ (Entity) and made of material x₃ (Entity)
kacma	x₁ (Entity) is a camera recording images of illumination type x₂ (Entity) to medium x₃ (Entity)
kadno	x₁ (Entity) reflects Canadian culture or nationality in aspect x₂ (ka, Property of x₁)
kafke	x₁ (Entity) coughs or farts or burps up gas x₂ (Entity) from orifice x₃ (Entity)
kagni	x₁ (Entity) is a company or corporation or firm or partnership chartered by authority x₂ (Entity) for purpose x₃ (nu, Event)
kajde	x₁ (ka, Property of x₂) warns or cautions person x₂ (Entity) of danger x₃ (ka, Property of x₂)
kajna	x₁ (Entity) is a shelf or counter or bar attached to supporting object x₂ (Entity) for purpose x₃ (nu, Event)
kakne	x₁ (Entity) is able or capable of doing or being x₂ (nu, Event or State) under conditions x₃ (nu, Event or State)
kakpa	x₁ (Entity) digs material x₂ (Entity) out of source or hole x₃ (Entity) with limbs or tools x₄ (Entity)
kalci	x₁ (Entity) is feces or excrement or dung of organism x₂ (Organism)
kalri	x₁ (Entity) is an open portal or passage permitting access to x₂ (Entity) by x₃ (Entity)
kalsa	x₁ (Entity) is chaotic or disordered in property x₂ (ka, Property of x₁)
kalte	x₁ (Entity) hunts or stalks prey x₂ (Entity) for purpose x₃ (nu, Event)
kamju	x₁ (Entity) is a column or pillar of material x₂ (Entity)
kamni	x₁ (Group<Entity>) is a committee with task or purpose x₂ (nu, Event) of body x₃ (Entity or Group<Entity>)
kampu	x₁ (ka, Property of members of x₂) is common or general or universal among members of set x₂ (Set<Entity>)
kanba	x₁ (Organism) is a goat of species x₂ (Taxon)
kancu	x₁ (Entity) counts the number in set x₂ (Set<Entity>) to be x₃ (Number) by units x₄ (Entity)
kandi	x₁ (Entity) is dim or dull or pale or non-intense in property x₂ (ka, Property of x₁) as received by observer x₃ (Entity)
kanji	x₁ (Entity) calculates or reckons or computes value x₂ (ni, Amount of nonce place or State) from data x₃ (Entity) by process x₄ (ka, property of x₁)
kanla	x₁ (Entity) is an eye body-part of x₂ (Organism)
kanro	x₁ (Entity) is healthy or fit or well by standard x₂ (si'o, Standard)
kansa	x₁ (Entity) is with or accompanies or is a companion of x₂ (Entity) in state x₃ (nu, Event or State of x₁ and x₂)
kantu	x₁ (Entity) is a quantum or ray or elementary particle of property or activity x₂ (ka, Property of x₁)
kanxe	x₁ (Entity) is a conjunction stating that x₂ (du'u, Proposition) and x₃ (du'u, Proposition) are both true
karbi	x₁ (Entity) compares x₂ (Entity) with x₃ (Entity) in property x₄ (ka, Relation<x₂, x₃>) determining comparison state x₅ (nu, Event or State)
karce	x₁ (Entity) is a car or automobile or truck or van for carrying x₂ (Entity) propelled by x₃ (Entity)
karda	x₁ (Entity) is a card nearly two-dimensional shape of material x₂ (Entity) with shape x₃ (Entity)
kargu	x₁ (ka, Property of x₂) is costly or expensive or dear to x₂ (Entity) by standard x₃ (si'o, Standard)
karli	x₁ (Entity) is a collar or ring or belt or band around x₂ (Entity) made of material x₃ (Entity)
karni	x₁ (Entity) is a journal or periodical or magazine or newspaper with content x₂ (Entity) published by x₃ (Entity) for audience x₄ (Entity or Group<Entity>)
katna	x₁ (Entity or Force) cuts or splits or divides object x₂ (Entity) into pieces x₃ (Entity or Group<Entity>)
kavbu	x₁ (Entity) captures or catches or apprehends or seizes x₂ (Entity) with trap or restraint x₃ (Entity)
kecti	x₁ (Entity) pities or feels sorry for x₂ (Entity) about x₃ (Abstraction)
kelci	x₁ (Entity) plays with toy x₂ (Entity)
kelvo	x₁ (Entity) is x₂ (Number) kelvin in temperature by standard x₃ (si'o, Standard)
kenra	x₁ (Entity) is a cancer disease in x₂ (Entity)
kensa	x₁ (Location) is outer space near or associated with celestial body or region x₂ (Entity)
kerfa	x₁ (Entity) is hair or fur body-part of x₂ (Organism) at location x₃ (Entity)
kerlo	x₁ (Entity) is an ear body-part of x₂ (Organism)
ketco	x₁ (Entity) reflects South American culture or nationality or geography in aspect x₂ (ka, Property of x₁)
kevna	x₁ (Entity) is a cavity or hole or hollow or cavern in x₂ (Entity)
kicne	x₁ (Entity) cushions x₂ (Entity) with material x₃ (Entity)
kijno	x₁ (Entity) is a quantity of or contains or is made of oxygen x₂ (Entity)
kilto	x₁ (Entity) is 10^3 in property x₂ (ka, Property of x₁) in dimension x₃ (ka, Property of x₁)
kinli	x₁ (Entity) is sharp or keen at locus x₂ (Entity)
kisto	x₁ (Entity) reflects Pakistani or Pashto culture or nationality or language in aspect x₂ (ka, Property of x₁)
klaji	x₁ (Location) is a street or avenue or lane or alley at x₂ (Location) allowing access to x₃ (Location or Entity)
klaku	x₁ (Entity) weeps or cries tears x₂ (Entity) about reason x₃ (nu, Event or State)
klama	x₁ (Entity) goes or comes to destination x₂ (Location or Entity) from origin x₃ (Location or Entity) via route x₄ (Sequence<Location> or Group<Location>) using means or vehicle x₅ (Entity)
klani	x₁ (Entity) is measured by number x₂ (Number) on scale x₃ (si'o, Scale of property of x₁ with kau)
klesi	x₁ (Entity or si'o, Idea) is a class or category or subgroup or subset within x₂ (Entity) with defining property x₃ (ka, Property of members of x₁)
klina	x₁ (Entity) is clear or transparent to transmission x₂ (Entity or nu, Event)
kliru	x₁ (Entity) is a quantity of or contains or is made of halogen of type x₂ (Entity)
kliti	x₁ (Entity) is a quantity of or contains or is made of clay of composition including x₂ (Entity)
klupe	x₁ (Entity) is a screw fastener for purpose x₂ (nu, Event) with threads x₃ (Entity) and frame x₄ (Entity)
kluza	x₁ (Entity) is loose or bloused or not tight on x₂ (Entity) at locus x₃ (Entity)
kobli	x₁ (Entity) is a quantity of cabbage or lettuce or leafy vegetable of species x₂ (Taxon)
kojna	x₁ (Entity) is a corner or solid angle in or on x₂ (Entity) of material x₃ (Entity)
kolme	x₁ (Entity) is a quantity of or contains or is made of coal or peat or anthracite or bitumen from source x₂ (Entity)
komcu	x₁ (Entity) is a comb shape of material x₂ (Entity) with tines or needles x₃ (Entity)
konju	x₁ (Entity) is a cone shape of material x₂ (Entity) with vertex x₃ (Entity)
korbi	x₁ (Entity) is an edge or margin or border or curb or boundary of x₂ (Entity) next to x₃ (Entity)
korcu	x₁ (Entity) is bent or crooked or not straight or twisted or folded
korka	x₁ (Entity) is a quantity of or contains or is made of cork or bark from tree x₂ (Entity)
kosta	x₁ (Entity) is a coat or jacket or sweater garment of material x₂ (Entity)
kramu	x₁ (Entity) is x₂ (Number) local area units in standard x₃ (Entity) with subunits x₄ (Entity)
krasi	x₁ (Location or nu, Event) is a source or start or beginning or origin of x₂ (Entity or nu, Event or Process)
krati	x₁ (Entity) represents or is a proxy or stands in for x₂ (Entity) in matter or function x₃ (Relation<x₁, x₂>)
krefu	x₁ (nu, Event) is the x₃-th recurrence of x₂ (Abstraction)
krici	x₁ (Entity) believes creed x₂ (du'u, Proposition) is true about subject x₃ (Entity)
krili	x₁ (Entity) is a quantity of or contains or is made of crystal of composition x₂ (Entity) in form or arrangement x₃ (Entity)
krinu	x₁ (nu, Event or State) is a reason or justification or explanation for x₂ (nu, Event or State)
krixa	x₁ (Entity) cries out or yells or howls sound x₂ (Sound)
kruca	x₁ (Entity) intersects or crosses or traverses x₂ (Entity) at locus x₃ (Entity)
kruji	x₁ (Entity) is a quantity of or contains or is made of cream or emulsion or puree of composition x₂ (Entity)
kruvi	x₁ (Entity) is a curve or turn or bend in x₂ (Entity) at locus x₃ (Entity) defined by set of points or properties x₄ (Set<Entity>)
kubli	x₁ (Entity) is a cube or regular polyhedron of dimensions x₂ (Entity) with surfaces or sides x₃ (Entity)
kucli	x₁ (Entity) is curious about or wonders about or is inquisitive about x₂ (Entity or Abstraction)
kufra	x₁ (Entity) feels comfort or is comfortable with conditions or environmental properties x₂ (ka, Property of x₁)
kukte	x₁ (Entity) is delicious or tasty or delightful to observer or sense x₂ (Entity)
kulnu	x₁ (Entity) is a culture of nation or ethos x₂ (Group<Entity>)
kumfa	x₁ (Location) is a room of or in structure x₂ (Entity) surrounded by partitions or walls or ceiling or floor x₃ (Group<Entity>)
kumte	x₁ (Organism) is a camel or llama or alpaca or vicuna of species x₂ (Taxon)
kunra	x₁ (Entity) is or contains or is made from a mineral or ore of metal type x₂ (Entity) mined from location x₃ (Location)
kunti	x₁ (Entity) is empty or vacant of material x₂ (Entity)
kurfa	x₁ (Entity) is a right-angled shape defined by vertices x₂ (Set<Entity>) with dimensions x₃ (Number)
kurji	x₁ (Entity) takes care of or looks after or attends to or provides for x₂ (Entity or nu, Event)
kurki	x₁ (Entity) is bitter or acrid to observer or sense x₂ (Entity)
kuspe	x₁ (Entity) ranges or extends or spans or persists or reaches across range x₂ (Entity)
kusru	x₁ (Entity) is cruel or mean or unkind to victim x₂ (Entity)
labno	x₁ (Organism) is a wolf of species x₂ (Taxon)
lacpu	x₁ (Entity) pulls or tugs or draws or drags x₂ (Entity) by handle or at locus x₃ (Entity)
lacri	x₁ (Entity) relies or depends or counts on or trusts x₂ (Entity) to bring about or ensure or maintain x₃ (nu, Event or State)
ladru	x₁ (Entity) is a quantity of or contains or is made of milk from source x₂ (Entity)
lafti	x₁ (Entity or Force) lifts or applies raising force to x₂ (Entity) at locus x₃ (Entity) in gravity well x₄ (Entity)
lakne	x₁ (nu, Event) is probable or likely under conditions x₂ (nu, Event)
lakse	x₁ (Entity) is a quantity of or contains or is made of wax from source x₂ (Entity)
lalxu	x₁ (Location) is a lake or lagoon or pool at site or within land mass x₂ (Location)
lamji	x₁ (Entity) is adjacent or beside or next to or in contact with x₂ (Entity) in property or sequence x₃ (Entity) in direction x₄ (Entity)
lanbi	x₁ (Entity) is a quantity of protein or albumin of type x₂ (Entity) composed of amino acids x₃ (Sequence<Entity>)
lanci	x₁ (Entity) is a flag or banner or standard of or symbolizing x₂ (Entity) with pattern x₃ (Entity) on material x₄ (Entity)
lanka	x₁ (Entity) is a basket containing x₂ (Entity) woven from material x₃ (Entity)
lanli	x₁ (Entity) analyzes or examines in detail x₂ (Entity) by method or technique x₃ (nu, Event)
lanme	x₁ (Organism) is a sheep of species x₂ (Taxon) of flock x₃ (Group<Organism>)
lante	x₁ (Entity) is a can sealed container for perishable contents x₂ (Entity) made of material x₃ (Entity)
lanxe	x₁ (Group<Entity>) is in balance or equilibrium under forces x₂ (Group<Entity>)
lanzu	x₁ (Group<Entity>) is a family with members including x₂ (Entity) bonded by standard x₃ (si'o, Standard)
larcu	x₁ (nu, Process) is an art creative application of craft or skill x₂ (nu, Event or Idea)
lasna	x₁ (Entity) fastens or connects or attaches or binds or lashes x₂ (Entity) to x₃ (Entity) with fastener x₄ (Entity)
lastu	x₁ (Entity) is a quantity of or contains or is made of brass of composition including x₂ (Entity)
latmo	x₁ (Entity) reflects Latin or Roman or Romance culture or language in aspect x₂ (ka, Property of x₁)
latna	x₁ (Entity) is a lotus plant or flower of species x₂ (Taxon) symbolizing x₃ (Entity) to culture or religion x₄ (Entity)
lazni	x₁ (Entity) is lazy or avoids work concerning action x₂ (ka, Property of x₁)
lebna	x₁ (Entity) takes or gets or gains or obtains or seizes x₂ (ka, Property of x₁) from possessor x₃ (Entity)
lenjo	x₁ (Entity) is a lens focussing rays x₂ (Entity) to focus x₃ (Entity) by means or material x₄ (Entity)
lenku	x₁ (Entity) is cold or cool by standard x₂ (si'o, Standard)
lerci	x₁ (nu, Event) is late by standard x₂ (si'o, Standard)
lerfu	x₁ (Text) is a letter or digit or symbol in alphabet or character set x₂ (Entity) representing x₃ (Entity)
libjo	x₁ (Entity) reflects Libyan culture or nationality in aspect x₂ (ka, Property of x₁)
lidne	x₁ (Entity) precedes or leads x₂ (Entity) in sequence x₃ (Sequence<Entity>)
lifri	x₁ (Entity) undergoes or experiences event x₂ (nu, Event)
lijda	x₁ (Entity) is a religion of believers including x₂ (Group<Entity>) sharing beliefs x₃ (du'u, Proposition)
limna	x₁ (Entity) swims in fluid x₂ (Entity)
lindi	x₁ (Entity) is lightning or electrical arc or thunderbolt striking at x₂ (Entity) from x₃ (Entity)
linji	x₁ (Entity) is a line one-dimensional shape defined by points x₂ (Set<Entity>)
linsi	x₁ (Entity) is a length of chain of material x₂ (Entity) with link properties x₃ (ka, Property of x₁)
linto	x₁ (Entity) is lightweight in mass or weight by standard x₂ (si'o, Standard)
lisri	x₁ (Text) is a story or tale or narrative about subject or moral x₂ (Entity) by storyteller x₃ (Entity) to audience x₄ (Entity or Group<Entity>)
liste	x₁ (Entity) is a list or catalog or register of sequence or set x₂ (Sequence<Entity> or Set<Entity>) in order x₃ (Entity) in medium x₄ (Entity)
litce	x₁ (Entity) is x₂ (Number) liters in volume by standard x₃ (si'o, Standard)
litki	x₁ (Entity) is liquid of composition including x₂ (Entity) under conditions x₃ (nu, Event)
litru	x₁ (Entity) travels or journeys or goes via route x₂ (Sequence<Location> or Group<Location>) using means or vehicle x₃ (Entity)
livga	x₁ (Entity) is a liver body-part of x₂ (Organism)
livla	x₁ (Entity) is a fuel or energy source for powering x₂ (Entity)
logji	x₁ (Entity) is a logic for reasoning about x₂ (du'u, Proposition)
lojbo	x₁ (Entity) reflects Lojbanic language or culture or community in aspect x₂ (ka, Property of x₁)
loldi	x₁ (Entity) is a floor or bottom or ground of x₂ (Entity)
lorxu	x₁ (Organism) is a fox of species x₂ (Taxon)
lubno	x₁ (Entity) reflects Lebanese culture or nationality in aspect x₂ (ka, Property of x₁)
lujvo	x₁ (Text) is a compound predicate word with meaning x₂ (Entity) and arguments x₃ (Sequence<Entity>) built from metaphor x₄ (Text)
lumci	x₁ (Entity) washes or cleanses x₂ (Entity) of contaminant x₃ (Entity) with cleaning material x₄ (Entity)
lunbe	x₁ (Entity) is bare or naked or nude
lunra	x₁ (Entity) is a major natural satellite or moon of planet x₂ (Entity)
lunsa	x₁ (Entity) condenses or liquefies on or into x₂ (Entity) at temperature x₃ (Number) and pressure x₄ (Number)
mabla	x₁ (Entity) is execrable or shitty or awful or rotten or inferior in property x₂ (ka, Property of x₁) by standard x₃ (si'o, Standard)
mabru	x₁ (Organism) is a mammal of species x₂ (Taxon)
macnu	x₁ (nu, Event or Process) is manual not automatic in function x₂ (ka, Property of x₁ or nu, Event) under conditions x₃ (nu, Event)
makcu	x₁ (Entity) is mature or ripe or fully grown or adult in development quality x₂ (ka, Property of x₁)
makfa	x₁ (Entity or nu, Event) is magic or supernatural or sorcery or witchcraft to x₂ (Entity) performed by person or force or deity x₃ (Entity)
maksi	x₁ (Entity) is magnetic producing magnetic field x₂ (Entity)
malsi	x₁ (Location) is a temple or church or sanctuary or shrine of religion x₂ (Entity) at location or serving area x₃ (Location)
mamta	x₁ (Entity) is a mother of x₂ (Entity)
manci	x₁ (Entity) feels wonder or awe or marvels about x₂ (Entity or Abstraction)
manfo	x₁ (Entity or nu, Event) is uniform or homogeneous in property x₂ (ka, Property of x₁)
manku	x₁ (Entity) is dark or lacking in illumination
manri	x₁ (Entity or si'o, Idea) is a frame of reference or standard for observing or measuring or determining x₂ (Entity) with rules x₃ (Entity)
mansa	x₁ (Entity or nu, Event) satisfies evaluator x₂ (Entity) in property or state x₃ (ka, Property of x₁ or nu, State)
manti	x₁ (Organism) is an ant of species x₂ (Taxon)
mapku	x₁ (Entity) is a cap or hat or crown or helmet or headgear of material x₂ (Entity)
mapni	x₁ (Entity) is a quantity of or contains or is made of cotton material
mapti	x₁ (Entity) fits or matches or suits or is compatible with x₂ (Entity) in property x₃ (ka, Relation<x₁, x₂>)
marbi	x₁ (Location or Entity) is a shelter or haven or refuge or retreat or harbor for protecting x₂ (Entity) from danger x₃ (Entity or nu, Event)
marce	x₁ (Entity) is a vehicle or mode of transport carrying x₂ (Entity) in or on surface or medium x₃ (Entity) propelled by x₄ (Entity)
marde	x₁ (ka, Property of x₂) are ethics or morals or moral standards of x₂ (Entity or Group<Entity>) about situation x₃ (nu, Event or State)
margu	x₁ (Entity) is a quantity of or contains or is made of mercury x₂ (Entity)
marji	x₁ (Entity) is material or stuff or matter of composition including x₂ (Entity) in shape x₃ (Entity)
marna	x₁ (Entity) is a quantity of hemp or marijuana or jute of species x₂ (Taxon)
marxa	x₁ (Entity or Force) mashes or crushes or squashes or smashes x₂ (Entity) into mass x₃ (Entity)
masno	x₁ (Entity) is slow or sluggish at doing or being or bringing about x₂ (nu, Event or State)
masti	x₁ (TimeInterval) is x₂ (Number) months in duration by standard x₃ (si'o, Standard)
matci	x₁ (Entity) is a mat or pad or mattress or pallet of material x₂ (Entity)
matli	x₁ (Entity) is a quantity of or contains or is made of linen or flax material
matne	x₁ (Entity) is a quantity of or contains butter or margarine or shortening from source x₂ (Entity)
matra	x₁ (Entity) is a motor or engine driving or propelling or providing power to x₂ (Entity)
mavji	x₁ (Entity) is a quantity of oats grain of species x₂ (Taxon)
maxri	x₁ (Entity) is a quantity of wheat grain of species x₂ (Taxon)
mebri	x₁ (Entity) is a brow or forehead body-part of x₂ (Organism)
megdo	x₁ (Entity) is 10^6 in property x₂ (ka, Property of x₁) in dimension x₃ (ka, Property of x₁)
mekso	x₁ (Text) is a mathematical expression interpreted under rules x₂ (Entity)
melbi	x₁ (Entity) is beautiful or pleasant to x₂ (Entity) in aspect x₃ (ka, Property of x₁) by aesthetic standard x₄ (Entity)
meljo	x₁ (Entity) reflects Malaysian or Malay culture or nationality or language in aspect x₂ (ka, Property of x₁)
menli	x₁ (Entity) is a mind or intellect or psyche of body x₂ (Entity)
mensi	x₁ (Entity) is a sister of x₂ (Entity) by bond x₃ (Entity)
mentu	x₁ (TimeInterval) is x₂ (Number) minutes in duration by standard x₃ (si'o, Standard)
merko	x₁ (Entity) reflects USA or American culture or nationality or dialect in aspect x₂ (ka, Property of x₁)
merli	x₁ (Entity) measures quantity x₂ (Entity or Number) as x₃ (Number) units on scale x₄ (si'o, Scale) with accuracy x₅ (Number)
mexno	x₁ (Entity) reflects Mexican culture or nationality in aspect x₂ (ka, Property of x₁)
midju	x₁ (Entity) is in the middle or center or midpoint of x₂ (Entity)
mifra	x₁ (Text) is encoded or cipher text of plain text x₂ (Text) by code x₃ (Entity)
mikce	x₁ (Entity) treats or doctors or nurses x₂ (Entity) for ailment x₃ (ka, Property of x₂) by treatment x₄ (nu, Event or ka, Relation<x₁, x₂>)
mikri	x₁ (Entity) is 10^-6 in property x₂ (ka, Property of x₁) in dimension x₃ (ka, Property of x₁)
milti	x₁ (Entity) is 10^-3 in property x₂ (ka, Property of x₁) in dimension x₃ (ka, Property of x₁)
milxe	x₁ (Entity) is mild or gentle or non-extreme in property x₂ (ka, Property of x₁)
minde	x₁ (Entity) issues commands or orders to x₂ (Entity) for result x₃ (nu, Event or State)
minji	x₁ (Entity) is a machine for function x₂ (ka, Property of x₁)
minli	x₁ (Entity) is x₂ (Number) long local distance units in dimension x₃ (ka, Property of x₁) with subunits x₄ (Entity) by standard x₅ (si'o, Standard)
minra	x₁ (Entity) reflects or mirrors or echoes x₂ (Entity) to observer x₃ (Entity) as x₄ (Entity)
mintu	x₁ (Entity) is the same or identical thing as x₂ (Entity) by standard x₃ (si'o, Standard)
